{
  "schema_version": "1.0",
  "project_id": "project_0a9d0f05b2226f0a9019328890aabbde",
  "project_name": "projeto-crash",
  "created_at": "2026-08-16T02:40:19.932654+00:00",
  "telemetry": {
    "enabled": false,
    "capture_prompts": false,
    "capture_tool_details": false
  },
  "retention": {
    "days": 365
  },
  "storage": {
    "operational_logs": "local",
    "aggregated_metrics": "git"
  }
}
