{
  "schema_version": "1.0",
  "project_id": "project_56ab8d9264e25ac161c5dd48933de913",
  "project_name": "agent-harness-canonico",
  "created_at": "2026-08-16T02:13:39.883959+00:00",
  "telemetry": {
    "enabled": true,
    "capture_prompts": false,
    "capture_tool_details": false
  },
  "retention": {
    "days": 365
  },
  "storage": {
    "operational_logs": "local",
    "aggregated_metrics": "git"
  }
}
