{
  "schema_version": "1.0",
  "project_id": "project_92777f109659cf303affbd254158b028",
  "project_name": "projeto-eventos",
  "created_at": "2026-08-16T02:40:19.926243+00:00",
  "telemetry": {
    "enabled": false,
    "capture_prompts": false,
    "capture_tool_details": false
  },
  "retention": {
    "days": 365
  },
  "storage": {
    "operational_logs": "local",
    "aggregated_metrics": "git"
  }
}
