{
  "schema_version": "1.0",
  "project_id": "project_8271ea550489ea1237fb883271f44b4f",
  "project_name": "projeto-mirror",
  "created_at": "2026-08-16T02:40:19.937297+00:00",
  "telemetry": {
    "enabled": false,
    "capture_prompts": false,
    "capture_tool_details": false
  },
  "retention": {
    "days": 365
  },
  "storage": {
    "operational_logs": "local",
    "aggregated_metrics": "git"
  }
}
